id,subreddit,context,newcomer,reply,newcomer_counterspeech,reply_counterspeech,reply_attack,newcomer_score,reply_score
ev1gaws,Braincels,Friendly Reminder... -        you will never have a girl call you yours -        you will never have a girl force your head into her chest -        you will never have a girl to confess your feelings for & have the same feeling reciprocated  -        you will never have a happy life with someone else  It’s over.,That's true.    Unless you get off this subreddit and work on being a better you.,"Nobody does that in real life.  Do you know someone who does triathlons, meditates, showers 3 times a day, works full-time, perfectly balances his free time between social activities, personal hobbies (that make him a better person, like learning Chinese or some other shit) and distributing soup to the homeless?  I don't. Because people don't do that, and that's normal. They go to the gym maybe once or twice a week for some time, then stop for months. They spend their evenings and weekends binge watching random crap because they feel tired after the shit they had at work, or simply spending time with their families.  Maybe they should lose a bit of weight, actually finish writing that story they began three years ago, go on that morning run, drink a bit less. They will try, they will fail, they will try again, stuff will happen and their priorities will shift. That's life.  But none of this has any real effect on their ""relationship potential"". Sure, if you're very obese, then losing weight will help you in many ways. If you're clinically depressed and can't function normally, then getting treated for it would be a game-changer. But most people aren't. Most people are average. Most people struggle with relationships, get with someone, have break ups, spend time alone, rince and repeat, and usually end up with someone long-term, even if it's not perfect.  Sure, try to become a better person. Everybody should do that. But it won't solve your relationship issues.",1,0,0,1.0,1.0
ebjnhqz,Braincels,"Holy shit this is some potent suicide fuel.    > ""*You'll never be a girl's erotic dream.*""    This probably hit me the hardest. Even if you ascend, your gf will never fantasies about you. She'll be thinking about all the Chads she's screwed when you have sex. She'll close her eyes and pretend that you are an attractive dude when you have sex.    Also that comment about how the scarring from being a subhuman virgin has ruined you forever. I have been saying that for a while now, once you're blackpilled there's no going back. You're ruined forever, even if you ascend by some miracle.","\> She'll close her eyes and pretend that you are an attractive dude when you have sex.    &#x200B;    I have a real question here. If you get romantically involved with a woman after being together for, let's say 1-2 years idk, will she never be fully in the moment during sex & be frequently idly fantasizing about Chads?    &#x200B;    EDIT: better phrasing","Unless you're physically attractive, no hole will ever fantasise about you. Even after 70 years of marriage, she'll still think of Chad when you hold hands, hug, kiss, cuddle, have sex etc.",0,0,0,0.0,3.0
dzpf9q1,CCJ2,"Plus if you take the cost of living into account, 6,000 RMB is actually pretty good. Have you seen how cheap the dumplings are? ",Oh god     I actually got offered 6000 to teach at a Uni in tier 88 lol,OP Here.    Funnily enough that's actually high for tier 88. Back when I was applying I got offered 4000 RMB for some tier 88 schools.,0,0,0,6.0,6.0
frz27ih,CCJ2,Check out this rune reading faggot,There are more rune reading faggots in China than Latin descendant faggots in America,"Ok buster, remember the opium wars",0,0,0,1.0,1.0
csdd770,CoonTown,"I think the social security system here in Finland/in other Scandinavian countries is a bit over-hyped in a sense that with proper insurance you can get much better and faster service. I would even dare to claim that almost all people who have a job + a brain have some form of insurance because of the waiting times at the public system + vastly superior service. As a student I have even invested in private insurance despite the public system and the student medical system. Compared to the states, the medical insurance here is much cheaper and everyone with a job can afford a decent one.    I've used both systems, public and private and have stuck with the private since the way they treat you at the public places is bad in my opinion. Generally this is a problem with almost all public institutions except police here, that works really well. The private institutions actually want you to return as a customer so they have the incentive to provide better service.","In Denmark, there would be no point in a private insurance, so dont agree with you there, dont share your experience vis a vis public service vs private. ",Haven't used any service in Denmark so can't really speak on that but here in Finland it's 100% worth it if you have a job at least.,0,0,0,1.0,1.0
csas6l4,CoonTown,"Yea, next time just say you have kids, OP.  Nigger kryptonite","According to the video from a few days ago, even saying you have kids doesn't work on niggers wanting to rape you.    ","True. With the amount of kids that niggers have, they definitely aren't scared of kids. Niggers often assign higher values to ""family,"" because they get to be part of their own little clan. ",0,0,0,23.0,24.0
cwwexhw,CringeAnarchy,"Sorry buddy, some of us have superuser access. GUess you're not a super user :)","Superuser? On Google? This is news to me, at least. Honestly, you have got to learn when to stop lying.","It's news to you because you're not ""In the Know""",0,0,0,3.0,-4.0
djxyxc6,CringeAnarchy,"My god, please do, that piece of shit film is laughably one-sided. It was funded by red pillers so she really panders to that worldview. ",It was NOT funded by red pillers.,"MRAs, whatever. The film is ridiculously one-sided. Look at who she brings on for the ""other side"" of things... christ.",0,1,0,2.0,0.0
dyik0na,Delraymisfits,"mind muscle connection means absolutely nothing, thats body builder pseudo science. ",Lmfao and how many years of experience do you have lifting weights?,10 years and a masters degree in S&C.,0,0,0,1.0,1.0
cytp94y,Delraymisfits,Jason's so crazy,When was this? I think her page doesn't even exist anymore after Jason order 66'd her,"I got them on 1-7-16 around 11am. His stuff has a way of dissappearing. Like the ""canner"" video. Im pretty sure he made 3 order 66 videos for oldschool bikini on Froday. He deleted two of them and left one when he apologized for the order 66. I think he left the last one because he didnt think he made so many of the same thing and all his instagram videos look alike from the front page.",0,0,0,2.0,2.0
cngv3vv,FuckYou,"Fuck you, I still have to work at a bullshit job for low pay for hours just to barely scrape by!","Sucks man. This whole thing is bullshit. If you makes you feel any better, I decided when my mom forced me to apply to disability that if I didn't get it, I was going to simply kill myself. I don't really want to be here anymore and stay because of my mom, dad, and brother. I look at it like I'm getting paid to stay around.","Oh damn, that's rougher than I realize. I guess we all go through tough times, one way or another. Honestly, I don't really hate my life that much. I'm pretty content! And I'm glad you're enjoying your current lifestyle, and I'm definitely glad that you didn't kill yourself. Don't ever do that!",0,0,0,2.0,3.0
hiamon9,FuckYou,I'm not that fat I am festively plump and also Hufflepuff is a bunch of roody poos so fuck your father in the shower,"Here is an idea. Keep doing what you do and don't judge others because they are enjoying life unlike you. Wtf is with fuckin fathers? Good luck fucking mine! Keep you shitty ""vibes"" to yourself.",Get raped,1,0,1,1.0,0.0
fp8wmi6,GenderCritical,"It's interesting to me that a radfem would see shaming/ calling each outher out for self destructive behaviors focusing on pleasing men in addition to providing good coping and self improvement strategies as 10 times worse than mainstream libfem stuff with male mods that routinely advocate for how the porn and sex work industry is so empowering and will ban you if you say lesbians don't have to like penises.    Out of curiosity, do you think PinkpillFeminism is also a horrible place, or just FDS?    Edit: Also, I haven't really seen what you call bullying on FDS subreddit, could you provide at least one example? I don't think the trueoffmychest post was even crossposted to FDS.","It was crossposted to PinkPilledFeminism, where multiple users shamed the TrueOffMyChest OP and said essentially that being sexually assaulted is a rite of passage to radical feminism (and they seemed very glad the OP would join their ranks after her 'future sexual assault').  It was horrifying to read.  Any therapist worth their salt would tell you that shaming is terribly self-destructive behaviour.  Most women on FDS and PPF have already been shamed enough by the people in their lives, they don't need any more of that derogatory behaviour.  It is an incredibly presumptuous and patronizing way to deal with these sorts of things.  Women-only spaces should at least be welcoming to *women themselves* instead of just tearing down those who don't believe in their ideology.","I never said I agreed with shaming on the trueoffmychest post. It was very clearly excessive and unproductive. I just said it doesn't happen on FDS like that, at least I've never seen it happen. And I asked  i\_love\_spaghetti\_ohs to show me a single example of bullying like that happening on FDS 3 times, and she ignored me and accused the sub and then me of bullying, shaming and putting women down.         It's funny to me, that a lot of PinkPill users also dislike FDS because they call us pickmeishas for being involved with men at all. And GC apparently thinks we should be lifting women up and supporting them without any criticism at all even when those women are putting their own gender down to look cool to men... (Again, I'm not talking about the trueoffmychest post, idk how many times I have to repeat that to make myself clear).",0,0,0,1.0,1.0
dpgpou3,GenderCritical,This is good. Honestly men should feel free to embrace what is traditionally feminine while still being men without being pressured to reexamine their gender identities.,Fuck everything about this.,Would you prefer he feel pressured to identify as female and then become centered in women's spaces?,0,0,0,-1.0,8.0
cjzkf95,GreatApes,I like all races except the blacks,I'm sure no races like you,"If that's the best you can do, maybe you should just keep your comments to yourself. ",1,0,1,-2.0,3.0
ccyzgf2,GreatApes,"The alleged perpetrator hired a lawyer and a handwriting expert. The expert claims its two different writers.    If you look at the receipt closely, and this is just a opinion, the word none and the signature look to be written with the same pen. To me, the word ""nigger"" is written with a pen that had a smaller ball.  ","without even looking closely they absolutely look like they were written with different pens in that picture. the color is different, the handwriting is different, and the ball is different.","The Tennessean, the local newspaper to the area included all of about 2 sentences on the handwriting expert, the attorney of the alleged perpetrator and the alleged perpetrators statement.     For what its worth you can call me a cracker for as low as 500 dollars.",0,0,0,2.0,1.0
ca0eftv,ImGoingToHellForThis,reeeeeeeeeeepost.,"Fuck, I didn't even know it was hahaha",Its cool ive done the same,0,0,0,0.0,1.0
cr6q1xf,ImGoingToHellForThis,The comic forgot the part where no one claimed the steel melted.,"You got to bone up on your conspiracy theories game bro    Many eye witnesses and journalists contended seeing lots and lots of molten steel at ground zero.     However jet fuel cannot melt steel beams. If the steel *is* melted, the official ""pancake collapse"" joke couldn't be accurate.     Luckily, all the steel was hauled away insanely quickly compared to the rest of the cleanup and destroyed (ok probably recycled)       This confused me too for a while. The whole ""can't melt steel beams"" is talking about how there *was* molten steel, and jet fuel can't be attributed to it. ","You would be more correct by saying ""molten material."" We don't know what it actually was; it was never tested. I hardly have any sort of expertise in metal or metallurgy, so perhaps this link can explain it better - http://www.debunking911.com/moltensteel.htm      As for the steel being hauled away, it makes sense. There were people alive under the rubble and considering it was in downtown Manhattan, they couldn't exactly put it on the sidewalk while they were rescuing human beings.      Again, no government source claimed that the steel beams melted; they didn't have to. IIRC, steel can start to lose it's integrity around 1200 degree Fahrenheit. That is enough to cause the collapse. I'm not one to think the government doesn't lie, but the idea that they would be behind some sort of orchestrated event with only circumstantial evidence present, is hardly believable.",0,1,0,2.0,1.0
dbfksw3,Incels,"It's so nice to have someone understand! I've offered him other women, I've offered to watch him masturbate, which he doesn't like, he goes in the bathroom to do & we joke about it by sending each other texts like 'you can do it' then he comes back in, we talk about the porn he watches & we laugh & cuddle. I've stuck through a LOT of his issues, his anxiety is really bad, he needs constant contact & reassurance, which is a struggle for me as I need alone time but I talk to him whenever he needs it, it seems the least I can do. In every other aspect, we're equal. I do miss the sex, I tell him that, I've even tried a few times & he could tell I was unhappy so he stopped without even asking me. We had sex for around a year after I quit work, a long time in my eyes & it just happened as I got suicidal, stopped eating & was almost sectioned for self harm. But he's still right there. We're not far off being intimate again, happily, I can have him touch my stomach & scars without flinching which is a big step. He says he wouldn't change a thing & I wouldn't either. ","You're such a trooper.  I come to this subreddit just for a glimpse of a very sad set of people.  (I don't mean sad as in pathetic, I mean sad as in I have genuine sympathy for them).    Anyway, these guys, who have never even kissed a girl and think all relationships are of a single specific shape of exploitation, are telling you that you don't understand your own life, your own partner, and your own relationship.  It's absurd, and you're going above and beyond trying to explain it to them.","Thanks! Said partner is home now, so I'm going to stop replying as I'm gonna make his dinner & watch GoT with him whilst these fools bicker amongst themselves. I'm sure they'll all think they've won as I stop responding, but hey, couldn't care less.",1,1,0,7.0,3.0
dlolviq,Incels,"I'm a female. Lurking to see what's up here, because you guys are talked about so much. This is pretty much how my last birthday (16th) was.",Tits or gtfo. There are no women on the internet.,will man tits do?,0,0,0,3.0,2.0
gagyd2m,MGTOW,"Let me get this straight. You met up with a girl to fuck, even though you knew she had a boyfriend? Seems like you're the one who fucked this up",He didn't say she had a boyfriend. All he said is that she found a sex partner during their FWB relationship.,"Correct. As far as I know, no bf",0,0,0,1.0,1.0
gwxxxxs,MGTOW,I thought this sub was men going they’re own way. How come there are so many posts involving women?,"In order to deal with cancer, you've gotta talk about the tumour and its mysterious ways. We live in a society that wants to shove pseudo feminism and gynocentricism down all our throats, whether we like it or not. We all need to come together, educate and help one another out.","Women are cancer? I’m a fairly certain the problem is overly horny men, not the  few women who profit or benefit from their horniess",0,1,0,2.0,0.0
cq12v2t,NeoFAG,"I want to make fun of the gaffots as much as the next guy, but Nintendo really is being fucking stupid about this. ",How? Because their company doesn't want people profiting off of their intellectual property? I see no issues with this. People like angry joe are the reason why fan mods and the like get shut down.,"Oh please. Gaffers are just mad that some people (YouTubers) are better off than themselves as usual. It's the same ""If I can't have it, then you can't either!"" attitude that you see in Off Topic.     Don't get me started on the Nintendo dick suckers either. They will defend anything they do. The company wants a cut for someone recording themselves playing a shitty fucking board game. What?",0,0,0,-5.0,5.0
crfgqa6,NeoFAG,"It's M3wthr33. He's no hero. He's a SJW faggot that posts on SA instead and holds a grudge against elf ears because he's a shitty developer who shilled for ""The Power Of The Cell"" for years and got butthurt about Harmonix (Like everyone in RockBanned like Methodis). He works on that shitty fighting game Skullgirls which is full of pedo bait trash.      M3wthr33 was a faggot before the SJW take over. He just assimilated into the cuck-culture at SA better ",Cool story.,"Google searching your name again? You are just as much a pathetic sperg as you were in 2004 and 2005 and 2006 and continuing to this day.     I mean, I commend you for being so fucking asshurt about ""THE POWER OF THE CELL"" you started programming for the PS3 to prove the haters wrong (Spoilers: Its still shit) and joined the dev team of fighting game that shipped broken at launch and was dead on arrival. Then relentlessly shilled the PS4 like a massive faggot begging Sony for a job even though the dev community knew the PS4 was a pile of shit since early 2012.     Such is life being m3wthr33. Professional cuckold and shill. Consumer of pedophile anime games (And even made a pedophile American game too). God that makes you suspicious hanging around Disneyland so much. Go back to SA with the rest of the trannies and cucks, faggot.     ",1,0,1,2.0,-1.0
e0wai8n,TheRedPill,"To me, one way to boil this down is to look at it like this:    ""If you want a woman, she does not want you. If you don't want a woman, then she wants you.""    What I mean by this is, women are instinctively and naturally disgusted with desparate fuckboys that approach them and their pathetic tryhard attempts to get laid. Men that suck-up to them, are spineless, never say no, or don't stand up for themselves to these women. This plus the whole Feminine Empowerment movement creates a class of bitchy Mega-Cunts in today's toxic dating environment.    To deal with toxic cunts that won't give you the time of day if all you're doing is simply saying hello or striking up small talk, I've found that reflecting their rejection back at them is utterly satisfying. Instead of not saying anything and slinking away like a ""nice guy,"" fling it back in their face. Forget taking the high road. If they are rude, you can be like ""Well, SOMEONE got off the WRONG side of the BED! /smirk + wink"" or ""Must be that time of the month."" or Scoff at them and chuckle to yourself. Make fun of them at THEIR expense, but still do it in a playful way that isn't overly hostile (they were rude to you, so you simply returned fire). Do this with the most arrogant, smug, shit-eating grin you can naturally pull off. Not saying to be narcissistic, but flowing with self-confidence. The key here is you must show that her rejection of you leaves you UNFAZED. You are putting her in her place by breaking that bitch with your words, and you are UNAPOLOGETIC, showing that you have a good defense to protect your ego from her intrusions. You don't even need to be a master of your own Self-Confidence to pull this off. Remember, it's how you are PERCEIVED, not how you actually ARE.    My 2 Cents.","If you want to show that her rejection of you leaves you UNFAZED, you don’t need to say anything.  If you need to be a shitty person back to her because she was shitty to you, then she is FAZiNG you bro.","Making a quip or a verbal response to a stuck-up cunt isn't for everyone. I do what I do because that's what satisfies me. If you define ""fazing"" as any sort of visible reaction incurred at all, then perhaps that's what meets your definition of such. My ""definition"" of ""fazing"" is that when a cunt sticks her nose up at simply saying hello, I don't get butthurt about it, and I play it as a game. Is it petty? Maybe. Is it fun? To me, fuck yea!",1,0,0,3.0,2.0
do1sfxz,TheRedPill,"Today I finally managed to hit it off. It changed my view over pussy.. Ok, so I'm a long time lurker here and it feels like it's about damn time I give something back to TRP.   To keep the story short and on point - I basically had sex after a long, and I mean really long, dry period - to the point where I felt virgin again. Only a year ago I have moved out of the dorm and finally had some private space, found a decent job that gave me opportunity to receive some kind of social status and therefore my confidence grew along with that, renewed my style and received a lot of compliments how refreshed I look, have been hitting gym for 10 months straight now and finally - been heavily practising night game in bars / clubs to the point where I got decent enough to eventually get action almost every time, which of course led to today, where I got laid...   The hype over pussy is immoderate and overrated - those were my first thoughts after failing to find the release for two times, while drunk and in the morning, my sore dick to this moment still reminding me of the disappointment I have found. Sure, it still feels like some sorts of minor achievement to be able to conquer someone, it wasn't that bad either - yet I have realized how silly it was of me to drool over this shit in my fantasies a year, two, ten ago.   Obviously, it was the moment where I truly realized how ignorant it is to make pussy one's life goal. Ironically life revolves around sex. It was the drive, the motivation to get myself out of my own ass and start exploring the world, after all. That was how it all started, that's how I found TRP. Things got different and such was an important play for the self-grow and awakening experience.   Once you start enjoying self-improvement road sex becomes insignificant, petty conquest, a mere drop in the ocean. There's so much more that can be done, so many more pleasurable experiences that can be found... I guess that's my point after all - don't settle for the small victories.   Pussy is fine but don't lose your head chasing it. If opportunity presents, get it - whatever. But in the end it's not worth stressing for.   Albeit TRP is a way to design our best sexual strategy, it's not just that. The pill is hard to swallow for a reason. Truth hurts and people are too lazy to run a self-improvement marathon. That's what the real core of TRP is to me and it should be for you too.","I'm new here and to be honest, most of the info on here is like some sort of robotic, soulless, pussy conquest manual. Whatever happened to calling sex love making not fucking.",Because we live in a society that glorifies sex. Get all lovey dovey too quick and women will run alot of the time. If love is so special its also unrealistic to thing everytime you have sex with someone youre making love. Its instinctual. Animals dont make love. Sometimes neither do we. Its hard to look at this sub without taking into account lust.,1,0,0,-14.0,11.0
emse3ah,TrollGC,"But like here’s a meta analysis of 52 studies done by Cornell university that states     “This search found a robust international consensus in the peer-reviewed literature that gender transition, including medical treatments such as hormone therapy and surgeries, improves the overall well-being of transgender individuals. The literature also indicates that greater availability of medical and social support for gender transition contributes to better quality of life for those who identify as transgender.”    https://whatweknow.inequality.cornell.edu/topics/lgbt-equality/what-does-the-scholarly-research-say-about-the-well-being-of-transgender-people/",Lol those are fake news. At GC we only accept WordPress and Tumblr blogs with anecdotal evidence as actual science.,Why pay for university level biology when tumblr.gov.edu is literally free,1,1,0,1.0,-1.0
ek7ol87,TrollGC,"They just want women to be safe!    No, not those women!    You know? Actual women! The ones with penises! /s",I wish I could give reddit gold to you.,"Someone gave me silver, but I also accept 'gold' in the form of well wishes and general good luck :D",0,0,0,9.0,10.0
fsrk1bd,Trufemcels,"Greek God? He’s literally average, it’s crazy how much lower standards for men are.","How is he average? Tall, white, blue eyes, good face, meanwhile she’s obese.","Being white and blue-eyed doesn’t automatically make someone attractive, not even conventionally.",0,0,0,0.0,1.0
