id,subreddit,context,newcomer,reply,newcomer_counterspeech,reply_counterspeech,reply_attack,newcomer_score,reply_score
f26q395,Trufemcels,"Met a guy on anonymus app, insists on sending him pic of me, blocks me after I do so. It's very late at night in my country but I doubt I'll get any sleep. I'm crying and I feel pain somewhere, not sure if it's chest, stomach or something in my throat.  It gets really lonely sometimes. I need to talk to a man. I need to flirt. I want to be strong and stop craving the company of a man, but there are nights I can't hold myself. I'm using an anonymous app for chatting and I have two golden rules because of past experiences: under no circumstances should I believe a chat could turn into something more than just a chat and under no circumstances should I share pics of me.  Tonight I broke both rules. He told me he doesn't care about looks and I believed him. I sent him my pic, he said 'nice' and blocked me. I don't know him. I don't care about him. It's really not about him. It's about me, not giving up hope. It's about this part of me that still believes  there's someone out there for me, someone will see me as beautiful, someone who will hug me and sleep with me. It's this little part of me that either died or became even smaller tonight. That's what is hurting me. It's the realisation that I'm lonely and I will keep being lonely maybe forever. It's another cycle of me getting excited, breaking my rules while in denial about my situation, and getting brokenhearted. It's the fear that it will happen. That I will want to try again.    I don't know how to handle the way I feel right now. There's noone to blame. There's nothing I can do.","Did he send you a pic of him? I don’t know that this is totally about the way you look. Some guys are just cruel af. They like to make women feel like sh*t. The fact that you’d told him that you were insecure about your looks gave him what he needed to use against you. Never, ever, ever let a guy know your insecurities up front. You don’t let them know until you’ve been dating for months and months and even then only 1 at a time. Never give someone that power over you.     If you’d just said “sure” and gave him a pic where you’re doing a cute pose (poses have nothing to do with looks) and smiling, and he reacted like this, then maybe he didn’t like the way you look. I know it’s not popular on this sub, but men DO like personality. At this exact moment, I’m overweight. I went through a serious depression and gained a ton of weight. But I have a bomb ass personality and I get asked out on a weekly basis. When I’m thin, it’s daily, so there’s definitely a difference, but not enough that personality doesn’t account for something."," Hi Becky! No, it was because of my looks! :)",1,0,0,1.0,1.0
e9h39rv,Trufemcels,"Your dad's rich ? What do you do with that money ? Schoolmaxx, careermaxx, buxxmaxx. Looksmaxx if you find that fun, but you don't need that shit at the moment: dating while young is awful. Young men are not mature enough, older men will just use you for sex and be condescending.","When would you say (generally) the right age is, maturity wise?  (I don't know how to phrase that without sounding condescending myself)      Ban me if you will, I'm a man.  Not trying to intrude, but understand if I am.  I'm genuinely curious, though.     ",I am too haha.,0,0,0,13.0,9.0
fqblo84,Trufemcels,"Just a reminder I went down the rabbit hole and joined some '-pill' subs. It was probably naive of me to expect any different, but it was an important reminder that there are, indeed, plenty of men out there who lack basic humanity. Make sure to stay safe girls!  https://preview.redd.it/9jkvd0pcj5y41.png?width=751&format=png&auto=webp&s=b28806ff95df40773834728d86ea7226450c9060",This is hilarious because men actually have nothing to offer. Not even “holes” or their dicks because the majority of them suck in bed.,"like literal vampires. they suck our energy and claim that they're creating something ""new"". ""aLL fEmaLeS dO iS cOpY eVeRyThInG."" no, it's called CONTINUITY and without it we would all be OBLITERATED because you can't improve upon nature, you dick. have a nice day.",0,0,0,3.0,2.0
e1lwocf,Trufemcels,Don't forget that Inceldate is a thing. Just a reminder. You all have a good day now. I'm gonna eat my weight in fried chicken and mayo covered chips.,"Jul 1, 2018",Yes very Clever.,0,0,0,3.0,1.0
c45dskx,WhiteRights,Trayvon Martin Was a Worthless Thug: The Lynching of George Zimmerman,"I really want to punch the guy out, but alas he is entitled to his own fucked up opinion.I understand that the media usually is bias towards one side, they always try to gain public support and thats nothing new, or ground breaking its just how their business works. He juxtaposes 2 pictures(one of Zimmerman and one of Trayvon) in the top of article with the following caption ""I am a 26 year old mortgage analyst, I have a job and a wife"". the other reads ""I am 6 2, a football player. I was suspended from high school"". I am sitting here asking myself what the fuck ever happened to the phrase  ""don't judge a book it's cover"". Seriously having a job and a wife doesn't make you a better person. Look at fucking Josef Fritzl in austria. He had a fucking job, a wife and kids. That didn't stop him from looking them up in the basement and raping them repeatedly. As for being 6 foot tall 2 inches and a football player, I was 6 foot 1 in high school I was an athlete and I even got suspended once for not doing my homework! I guess that makes me a thug by definition? Am I right or am I right!!!  The rest of his ""Gelaber"" as we germans call it he just puts fault on everything and everyone but the shooter himself. How do you even go to reason with some one like that.","""Don't judge a book by its cover"" is a Leftist meme designed to prevent us from stereotyping even when the stereotypes are accurate.  It's bullshit.",1,0,0,2.0,-1.0
c71co1m,WhiteRights,Why white pride is no longer necessary: My take on racial segregation,">No, dear friends, I was wrong and blind. I later met a woman who introduced me into the occult and encouraged my spiritual and emotional development.     Too bad she forgot to introduce you to the concept of different races having different racial karmas or maybe you wouldn't be mired in new age feel good gobbletygook.","Karma is not determined by race, it never has. Karma is simply the subconscious decisions we make which effect our outlook on life.    Also, I'm Gnostic, not New Age.   ",0,1,0,2.0,0.0
dprhqbg,WhiteRights,"as a non american, how much money is required to live for a month decently?  im actually really suprised about your reactions since this seems pretty reasonable to me, then again i live in switzerland where everything is expensive as hell",$2000 a month is pretty low standard living. Like eating cheap and doing almost nothing that isn't planned/saved for. $4000 like here you could comfortably have a family and have fun *if* you budgeted well.,"huh so it's not really that diffrent from here, how is 4k considered ""too much"" for a family of five ?",0,0,0,3.0,1.0
dk0lirz,WhiteRights,"I got a kick out of this ""Human rights group condemns China as the 'worst abuser of internet freedom' in the world"". Have they never heard of North Korea. ",you can't abuse an internet if it doesn't exist,North Korea has the internet to some extent of course not in the same way that we do. But they do have it. It's just the OS is super restricted of course. I believe the only real pages they have though are all about their mr pig leader and what he is doing.,0,0,0,14.0,11.0
ekc9fqb,asktrp,"Got a pretty solid and caring girl with green flags left right and center.  When we started to see eachother she would ask me what my rules were and bring me food etc.  Always down for sex and also wants to find another girl for us as ages bi.  Been seeing her for roughly a year although the first months of it I treated her like a plate and then we ended up having some really great times together and I realized we had good chemistry and a connection and then not too long after I got serious and emotionally available I opened up to her and showed my demons and ended up super super depressed and not leaving bed for days at a time.  This was maybe october-ish.  I know that I fucked up the power dynamic in it but I still dont think its oneitis and I think this chick will be the one that got away.  I need to know what I can do because after months and months of trying to be and act better this depression has actually got worse.  She wants to remain dating but check me into an inpatient mental hospital and then move outta our town.  I can see every day how the more dominant one is yet cause I showed incredible weakness but I guess what I need to know is how I get control back into my hands, even just over myself so that my frame can become solid again and I can stop treating myself like shit with all this self-sabotage.  My hope is then maybe things can balance out and I can move forward in a healthy non-toxic relationship.  How do I put myself back on the right path and back into the right mindset that won me the 4'7 h cup 90 lb Russian unicorn bros?","I don’t have oneitis, but also she will be the one that got away.    Bro, you fucked the power dynamic. You can’t crawl back from it. Move on.",Yeah no dude where I'm from we have like 1.5mil people for a province the size of Texas so it's a lil different not like I meet girls every day and that said I just dont wanna have to restart being that I've finally gotten vulnerable enough to call one a girlfriend and say I love her,0,0,0,2.0,0.0
cg4q0n9,asktrp,"I'm sorry your first relationship went that way.    Cheating is rarely something you can control. However, the best way to avoid it is to choose your partner carefully.    That guy who gets you hot without saying much? He does that to other girls too and unless he has a strong moral compass, there is no need for him to be monogamous.    You can't make a cheater stop cheating by draining his balls or cooking him food. It is in-built to them. They need it for validation or for selfish needs. I can never be in a LTR because I find other women too attractive and getting a new one into bed or obsessed with me is a fun game.    Know what you're getting into, choose wisely.  ",>I can never be in a LTR because I find other women too attractive and getting a new one into bed or obsessed with me is a fun game.    I applaud for for not trying to have your cake and eat it too. I think a lot of redpillers are trying to get the best of both worlds and fucking over poor girls with no discretion. Then you end up giving someone trust issues for the rest of their life.     This is coming from another guy for what it's worth.,"Oh, I'm sure I have my own issues contributing to it. I was having a chat with an older woman about my love life and I said there are two reasons I can't be in a relationship:    1. I can't give the women what they want out of a relationship.  2. I don't think there is a woman who is worth me bothering.    So I've got my own issues. Plus, I've got kids which complicates things.",0,0,0,3.0,2.0
gvivszd,asktrp,"Found out girlfriend has had a MMF threesome I found out my LTR has had a MMF spitroast/DP in the past.  She claims to regret it and have no enjoy it.   Shes very submissive, cooks and cleans, sex whenever I want, very loyal and honest, basically everything I've ever wanted in a girl.   If I dump her I'll be sad as I love her, and shes definitely improved my quality of life. I dont want a threesome with her because I dont want to put her through that.    How do I proceed?",Like she cheated on you? Not clear from what you said.,No. About a year before we started dating.,0,0,0,0.0,2.0
dbg91gg,asktrp,"I need some help, I can't communicate well A year ago I discovered TRP, I changed my whole life, moved to a new city got a new job, rented a new place, read books, lifting, started talking to people.  Now I'm a good conversationalist, people enjoy talking to me but that's mainly because I use the tip in Carnegie's book, ""make everyone seem interesting"". I listen more than I talk, I'm good with women because I'm generally funny and can keep em talking for a long time and keep it fun, **because they do the talking**  But I have a problem, sometimes well, most of the time I feel I cant communicate my ideas well, people have often said that to me and I've noticed, I tend to repeat myself, midway through the sentence I realize what I say doesn't make sense, I feel like whenever I speak a lot, at some point I lose ""focus"" and I just ramble, some idea gets through, yes but not what I have to say.  It has evolved to the point where I have to write down a small script before having a phone conversation with someone and try to stick to it to the best of my skills, but if the conversation drags out for too long I feel like sometimes I answer out of instinct, the first thing that comes into my head instead of forming coherent ideas.  Same thing happens whenever someone asks me something out of the blue. The other day my boss asked me about the status of some repairs we had to do. I noticed my problem, paused, started thinking, spoke in clear articulated words and explained what happened, then he asked another question and I answered, then another and I started to ramble, in the end he mostly got what I meant but, I feel like I can't explain myself well.  I do tend to talk alone sometimes, but even then when I practice saying to myself (no one else) things that happened that same day, I start to ramble, change the subject, then change it again, then return, then change it then forget what I was saying and can't coherently connect that with what I started to say.  I'm generally an honest person, but not by choice I literally *can not* lie, because often when you lie you have to come up with the lie on the spot, and I'm just unable to do that, the only instances where I can lie is when I have time to prepare beforehand and practice infront of a mirror  I'm way better at writting because I have **time** to think what I try to say, but in my job sometimes there is no time to think you have to speak right then and there and I feel like its in those situations when my problem shows  It's frustrating, in the past few months I've avoided talking for long periods of time instead ask mostly questions.   Has anyone gone through this? Or does anyone know at least what kind of disorder or disease it is?","Op, start meditating in the morning and before you go to social events. Listen to audiobooks. Limit TV watching. Read more. Try writing...Or anything else that allows you to finish your thoughts. Judging from your post, you are good at writing and are capable of this. Keep doing it.","This is something I considered, meditation. I don't know what kind of results to expect but I hope at least it can keep me grounded  Thanks!",0,0,0,1.0,1.0
c5jgj9x,dolan,This exquisite fine comic was never on /r/dolan.  You're a homosexual and you can go perform fellatio on a black male.    Best regards,"Although I am offended by your homophobic racist comment I respect your opinion. However the original poster could have at least made an effort to at least add a little bit to the great work of the original creator of this comic.     Best of luck in your future endeavors,     Regards",You're a malignant neoplasm characterized by the proliferation of anaplastic cells that tend to invade surrounding tissue and metastasize to new body sites commonly known as cancer.    You can go perform sexual intercourse with yourself.    Best regards,1,0,1,40.0,43.0
cc9lc3s,dolan,I didn't understand the last frame at all,The fuck you say? Talk normal,Fak u,0,0,1,22.0,5.0
c45h6my,dolan,Conspiracy revealed,Comic sans fag,Whu givs a fuk,0,0,0,-1.0,2.0
c45vhkw,dolan,and a week later we have 80 subreddits for every dump dolan took in each comic because the whiteducksupremacist mods are hating the things that wont give them the weirdest of boners    I CALL SHITTY SUB    rgsds,"I see we meet again, you sexy German man.","AMURICAN, I KNEW WE WOULD MEET HERE OF ALL PLACES.",0,0,0,1.0,2.0
cne9zsy,fatpeoplehate,"They want to feel small and petite like, you know, normal girls and hooking up with a giant is the only way aside from actual effort.",Won't dating a >6'0 *fat* guy make them feel even more small and petite though?,"A *fat* guy?! Are you suggesting a cupcake princess *not* have her musclebound hunk of burning love, LORD OF SHIT?!",0,0,0,16.0,41.0
cojc80a,fatpeoplehate,Cheat week ^^^^^teehee,"Cheat year. Amirite? Guys, I'm not fat, it's just mah genetics.",Cheat life,0,0,0,30.0,25.0
coosoai,fatpeoplehate,I love this because before she said she avoids carbs. In her head fruit and veg are protein apparently.,"[TVP contains from 50% to 70% soy protein](http://en.wikipedia.org/wiki/Textured_vegetable_protein) and [Steak has 25g of protein per 100g, so is 25% protein](https://www.google.co.uk/webhp?hl=en#safe=off&hl=en-GB&q=protein+in+steak) Vegans and vegetarians can obtain plenty of protein, like Mike Tyson is a vegan and he's all about getting his protein.","It's also fucking disgusting and has too much soy and other estrogen-promoting stuff for my taste.     If you are veggie, Whey, Casein are your best bets, Vegans will want pea, rice, and various grain proteins. All available from ""health"" food stores.     But lets be honest, eating natural, and being a healthy veggie/vegan are kind of exclusive. The carb/protein ratio of MOST fruit/vegetables will never be balanced. Supplementation requires refinement. ",0,0,0,1.0,-5.0
cktw1j9,fatpeoplehate,"Can confirm, 75% of Marines dip or smoke. ",A lot of Military folks do because you have to go to a smoke pit somewhere to smoke.  Not a lot of time for breaks means dipping is a convenient alternative.  All you need is a place to spit.,This Marine never smoked in a 7-ton. Nevar.,0,0,0,16.0,5.0
eq0kted,frenworld,Nice story fren :),What the fuck is this subreddit?,Are you lost fren? :),0,0,0,-5.0,21.0
emgcjig,frenworld,Yeah but are you tho? Who are the non-frens?,They are obviously Nazis or white supremacists.    Non-Frens are people who oppose them but also all black people and minority ethnic groups      http://imgur.com/gallery/  Like c'mon it's obvious that they are talking about creating an ethno state.,nice link!,1,0,0,-9.0,1.0
ecs594h,frenworld,"Ghosting is mean frens. This is why when you don't want to see a girl anymore, you should tell her to her face. We have to set an example for females, frens. They have no moral compass.",I was gonna upvote your comment because it was wholesome but the last two sentences ruined it for me.,Sorry fren.,1,0,0,1.0,2.0
ehdph2t,frenworld,Thanks I hate it,Honk,BOP,0,0,0,1.0,1.0
emb6vf6,honkler,"Now I'm not implying anything here but..    ""Autistic people have difficulties with interpreting both verbal and non-verbal language like gestures or tone of voice. Many have a very literal understanding of language, and think people always mean exactly what they say. They may find it difficult to use or understand:    * facial expressions  * tone of voice  * jokes and sarcasm.""    \-  [https://www.autism.org.uk](https://www.autism.org.uk/)","Nice, casual ableism while complaining about casual (nonexistent) racism.","Not saying autism is bad, just pointing out the symptoms that people in certain reddits display :)",0,0,0,0.0,1.0
eogn6ik,honkler,"Imagine spending $53,000 because you think a gesture older than you are is somehow racist now. Don't think for yourselves, tv people said it bad so it bad",When did this become an offensive gesture?,Ever since 4chan pretended it meant white power to trick the media into believing something fucking retarded. They fell for it and instead of admitting they fell for a prank they are pretending that's what it means now because it's a convenient weapon to persecute people with.,0,0,0,13.0,36.0
emnsmgo,honkler,It seems as if the right prefers to make their political opposition look bad (drawing them as muh NPC SJW) instead of using actual arguments. Why? Well because they’ll know they’ll lose in a conventional debate,as if the left doesn’t do the same,They don’t,0,1,0,1.0,1.0
emsombh,honkler,r/TIL is holohoax propaganda 95% of the time,Why is TIL private?,"Yeah, I guess I got honked out...",0,0,0,3.0,2.0
ds3lfhw,milliondollarextreme,Pairs well with some tap,You retards dont get that the illuminati slipped 'soy boy' in as an insult specifically to undermine the only white male owned soy business on the planet. Way to go....,You're saying that like it's a bad thing.,0,0,0,1.0,2.0
d6wedqf,milliondollarextreme,Japan fucking sucks. I'd love to see Sam rip it apart and trigger all the weeaboo millenials who worship it.,You wouldn't be saying that if you wife was from there son,Nice name turbofaggot,0,0,1,4.0,-2.0
dq5vzrt,milliondollarextreme,DOOM OST is fucking garbage .. all credibility out the window .. Djent trash,does...inione els fink dat... uhm... duhm awst is gawrbahge???,copying what someone says but in a retarded voice is the literal peak of first-grade debate tactics.,0,0,0,1.0,1.0
d78xpt5,milliondollarextreme,"Thought you guys might enjoy this, the entirety of reddit and twitter is shitting on Lena Dunham ",MGTOW is my favourite thing. Its low test internet flabs that volunteer themselves out of the genepool.,Lol ok,0,0,0,17.0,-1.0
cbltxer,opieandanthony,Or let's not give him more views.,"what does it have to do with views, I watched the video and couldn't agree more... You just sound like the douche who wants more imaginary up votes?","I was speaking to the people who disagree with the person in the video... which is most of the O&A subreddit.    If you agree with him, then by all means, give him views.",0,0,0,-4.0,2.0
e5nucm2,opieandanthony,"Battlefield 1 is Nana's favorite game, right? ",This is a weird flex,Feed Nana army nigga,0,0,0,1.0,1.0
c8bnxp0,opieandanthony,"What he ""wants"" is people to keep listening to his show.","He's doing a piss poor job of that.    Like another user said, the show has devolved into mostly garbage. ""Used to be funny, with their comedian friends coming in to talk shit and make jokes, but these days its just Opie talking about twitter, Ant being full blown racist and Jimmy idolizing celebrities.""    ","Here is the thing. I believe he is right. Before the downvotes fly, hear me out. Humanity can be traced back to about 4 or 5 people. One of those people was the smartest. One was the strongest. One was the most clever, etc. Now, also note that I am of mixed race. I've dealt with this my entire life. I don't really care one way or another, and I doubt he does either. Its just an easy way for headlines and viewers to be made. No scientist will touch this topic with a ten foot pole. You could be a Nobel prize winner, and you would get laughed out of any institution for even suggesting it. All the equality we have fought to promote would be gone after the study was done. Are Asians considered smarter yet weaker physically generally? Yes. Does that mean I haven't met some that are dumber than a box of rocks or ripped as shit? Hell no. Genetics do play a big role in determining a persons future, but that doesn't mean you can't overcome them with hard work. ",1,1,0,2.0,2.0
dgl5q64,opieandanthony,"Holy shit, I think i just found the biggest faggot on Reddit ",Jesus this guy is a cunt.,*Am not!  Am not!*  lol,0,0,0,2.0,1.0
d6k59xb,sjwhate,College student places ad for ‘non-white’ roommate,"Imagine the furor if a white student placed the ad and said ""white people only.""  How do these people not understand that they're the ones being racist and xenophobic by saying a space can only be safe if it lacks white people entirely?","But but, reverse racism doesn't exist!",0,0,0,7.0,7.0
d5ibsyd,sjwhate,"White male (family is a mix of arab and berber) but anyways most of the extremists are wahanis, those who arent extremists tend to be sunnis or shan (sorry i forgot what its called). While we obey the quran, we know some of the information is wrong and old. I was born into a muslim family but my mom told me I could be any religion I wanted, I stuck to my muslim beliefs but I have different beliefs, like how gay marriage should be allowed, and that women arent objects. ","""I follow the quran but not really.""    ..kay.","I know plenty of Christians that ""follow the bible, but not really"".",0,1,0,0.0,1.0
crzp7nx,sjwhate,"Seinfeld: College Kids Way Too PC Now, They Don’t Even Know What ‘Racist’ Means ","Agreed even though I'm young. Too many twats on Tumblr and reddit get offended to easily, I blame gay culture and liberals.    Yes, I said Liberals. I also blame SJWs for this shit. I'm pretty sure 99% of SJWs identify as Liberal.    Let me ask all the butthurt liberals about to get offended, do you believe in gay marriage? Because I don't because it's immoral and wrong. Any counter argument from a Liberal now will just classify them as SJWs.","A counter being that I do not find it immoral or wrong.     Is that SJW enough for you?    Thus see no problem with it nor a problem with people doing whatever the hell they want to do consensually together in privacy of their own homes and relationships.     Im also betting you think marriage is being sworn to some god or the other thus their words say its immoral or wrong. Yet can you not marry as an atheist, under no god or a god that is accepting of such a union?",0,1,0,-14.0,10.0
dgozsnz,sjwhate,Phd in engineering i believe. Not a scientist,Bachelor's*,Wow. No words...i have no words.,0,0,0,24.0,11.0
