id,subreddit,context,newcomer,reply,newcomer_counterspeech,reply_counterspeech,reply_attack,newcomer_score,reply_score
e1pr7eg,Braincels,">  If you marry a virgin, she can’t compare you to anyone else.    I wouldn't trade my situation to be honest. I'm married to a girl I met in High School. We were both virgins when we met at 16, we remaining close / good friends for a long time. But We both had partners (both experienced a couple 2+ year relationships) and then we went from being ""best friends"" to ""girlfriend/boyfriend"" in our mid-20s. We've been together for a decade (ish) now, married. And it is fantastic to be married to my best friend. Seriously.    Regarding our past sexual partners, I'm glad I wasn't my wife's ""first"" - nothing to do with sex at all. But long-term relationships are seriously hard work. After 2-3 years or so, you really need to put some effort in to make sure you're relationship doesn't die. Now, I'm personally really glad that both myself AND my wife made all our LTR fuck-ups in previous relationships. We learn't some brutal lessons in previous relationships and I'm glad they're not baggage in THIS relationship (my marriage).    Also - sure, if you marry a ""virgin"" they can't compare you to someone else, if that is a concern. However, they will also wonder for their entire fucking life what it's like to have sex with someone who is NOT you. Their whole life. Think they'll manage??    Seriously, get all that shit (fucking) out of your system before ""settling down"". Marrying ""as"" and ""to"" a virgin is fine, but it's usually for irrational reasons (religious - which is terrible, marrying someone just so you can finally fuck them/someone is not exactly the fucking dream-marriage).     So - if I were going to get married again - I'd be incredibly skeptical about marrying a virgin. Assuming they end up liking sex - the best case scenario; I trust them completely and ""know"" they won't cheat. Well great, I'll just know my wife will never know (and ALWAYS WONDER. ALWAYS.) what sex with other people is like.    If you end up going on a ""break"" 10 years in, for a couple months. No prizes for guessing what they're ""up to"".",This is some serious coping.    Your glad your not your wife's first ? Literally no man has ever thought this,Some of you guys are seriously deluded. I'd wager that 90%+ men over 25 would be seriously weirded out of their potential partner *was* a virgin. And most people don't seriously consider marriage until around that age anyway.,0,1,1,9.0,1.0
eua1fva,Braincels,"JBB in reality: woke SJW white foid stressed over being over BLACKED and losing some appeal to Chad. It's always about Chad, not Tyrone for a high status foid.","This isn't true in the slightest lol. I'm in college and have to put in minimal effort for casual sex from white girls. The kid in the OP is ugly and stole her very first kiss, of course she'll be uncomfortable.     This sub is honestly just a minority of ethnic males trying to act like everyone not white has it bad so they don't feel left out, and a majority ugly white guys roleplaying as ethnics so they can circle jerk and live vicariously through the concept of Chad. Your name is very fitting btw.",Ban this motherfucker,1,0,1,-6.0,9.0
dzaqwgs,Braincels,I propose a new rule:    No bad posts allowed,I think that would ban the whole sub,"No, many posts are good. You would be banned. ",1,0,0,5.0,5.0
euf5mvz,Braincels,"Whenever I see them spread misconceptions and lies about incels, I just HAVE to try and correct them, even though I know it’s useless.",I have the same issue. If someone says something so radically dumb I can't help myself but tell them what I think,"Glad you agree, r/OwningSlaves",0,0,0,27.0,31.0
fr31e2t,CCJ2,"Ting Wo Timmy Taco-Tossers Listen up, I’ve bout had my fill of you teenage tot ticklers bringing up “legitimate” issues about a country that is shaped like a Chicken. Speaking of which, how is a country shaped like a Chicken not even going to have that great of chicken? Duck? They got it. Eggs? They got it. Beef, pork, they got it. Chicken? Seen it once and it was shit.   Anyway, scrolling through the sub it seems like there’s been an influx of Timmy Bu-Dongs testing waters with Ted Talk like titles and concern level content. Have you piss fisters ever even eaten a rainy’s raw untrimmed village taint? It has a certain hint of I-haven’t-showered-in-days taste that makes you want to walk down the road and grab a 24pack of tsing Tao to solo while smoking zhonghuas - all while thinking of the next one.   If I see one more cross post on some Meta garbage about the takeover of a Chicken-country I’m going to lose my fucking mind. I’m trying to jerk off to a story about a rainy getting wet to the words of yingwen and a viv getting slammed on top of a preschooler-sized picnic table after a few lamb skewers.   You know what really matters? That little toddler pinching one off on the sidewalk. That tot takes a bigger shit than half you fags on here and has seen more tit action than all of us probably. That is the kind of kid I look up too. 0 fucks given. If half of you Tims had the toughness of that tic-tac shitting on the street I’d be jerking off to a lot more quality content and not losing my stiffy every time I open a thread",Walking down the street smoking Zhonghuas who are you trying to kid you're a Liquan warrior. The only time you've smoked a Zhonghua is when Uncle Ganbei tossed one at you.,"You think an astute scholar such as myself, a man who labored day in and day out to teach 5 year olds the intricate nature of the global and internationally recognized language of American would smoke LI QUN??    I’m insulted, chungwhas are by far the best way to impress and seduce my 15 year old wife’s mother. I’d never smoke that lichoon trash. Friends with people who do tho no judgement.",0,0,0,2.0,2.0
dennn7b,CCJ2,"More like, Penthouse B is what the clowns are telling their family and friends back home where they are living. Penthouse A is where they are actually crying themselves to sleep at night. ","To be serious, it's nearly impossible to find penthouse B in a one bedroom layout in T2 China. The nice apartments are usually set up for 2 or 3 Bedroom becaurse must buy house to get married do you know it? Very very little demand for high end apartments in studio/one bedroom layouts.   ","What peasant only tent one bedroom? You need one for the fuck, one for the work, and one for the treadmill you'll never use. ",0,0,0,5.0,1.0
dbtzftv,CCJ2,............    I am literally crying in your girlfriend's vag-eye-NAH right now.    Wiping tears of plactic-brick shame from my burning eyes with your SO's saggy-flaps as I type.,Weird coincidence.  Some dude I'm fucking in the ass while he cries onto my Rainy's bald vulva was just posting on Reddit,That was you??    I thought somebody was just taking my tempreture. You should-a wore boxers when developing.    Now you may wanna look away. Am about to give your GF a goiter.....,0,0,1,2.0,2.0
esdifkf,CCJ2,someone wants to stay in ladyboyguo,whenever I fly into or out of nong territory it's always a fear of mine that some first-time-on-a-plane fuck will open the emergency exit midair.,Luckily that's really hard to achieve. But I'm sure they already tried that.,0,0,0,5.0,1.0
cr4vrdt,CoonTown,"Somali isnt even a black language, its related to Arabic and Hebrew.   Somali people are genetically similar to Northafrican berbers.  Somali people hate blacks more than the kkk.  Somalia is part of the Arab league and claim descent from Arab founders. Stop equating my people with damn adoons.   Most Somalis dont act servile like blacks around whites, why because we are not black. We are Somali.","Except they do act servile just as niggers do. Perhaps not around whites but definitely towards Arabs as evidenced by your post.    Somali's are to Arabs what uncle-Toms are to whites, they want to be Arabic so bad they're willing to glorify centuries of Arab occupation because the Stockholm syndrome in Somalia is that bad.     Niggers are bad, but at least I appreciate it when niggers try and find their own ethnic solidarity and stand on their own two feet. Niggers (including Somali's) who try and throw their entire race under the bus to be accepted by some other ethnicity are the worst kind of people, literally two steps backwards for evolution. ","Back during the founding of Islam there was a huge civil war in the middle east, Arabs escaped into Northern Somalia they are the founders of the Somali race. Holy fuck how many times do i have to explain that to you. Just like the Brits established the original white americans. The Arabs established Somalis. We are descendants, dna testing proves we dont originate in Africa, we share nothing in common with black Kenyans our nearest negro neighbors.     http://en.wikipedia.org/wiki/Somalis#Y-DNA    According to mtDNA studies by Holden (2005) and Richards et al. (2006), a significant proportion of the maternal lineages of Somalis consists of the M1 haplogroup.[79][80] This mitochondrial clade is common among Ethiopians and North Africans, particularly Egyptians and Algerians.[81][82] M1 is believed to have originated in Asia,[83] where its parent M clade represents the majority of mtDNA lineages.[84] This haplogroup is also thought to possibly correlate with the Afro-Asiatic language family:",0,0,0,1.0,1.0
cqtstko,CoonTown,The winner? The fuckin jews who publish this shit and charge each and every set top box $60+ to watch a nigger fight a wetback.,You see that's a chicken shit answer. You don't have integrity bro.,"A chicken shit anwswer? It's the god damn truth. I don't care if a nigger or a spic wins... in the end its the fucking jews who win.    It's not that I don't have integrity, I just don't care to pay $60 to watch a couple minorities battle it out, when I can just load up jewtube and watch that shit for free. ",0,0,0,-4.0,5.0
cpjzzf7,CoonTown,"According to a Japanese I know, they don't really have racism against niggers. I mean, obviously they consider them inferior, but the Japs look down on everyone. When it comes down to it they just don't have enough contact with niggers to form real, informed racism against them.    ... so they don't see this kind of thing as offensive and racist. To them it's all just a laugh. ",> To them it's all just a raugh.,Hey! That's lacist.,0,0,0,13.0,7.0
cqs251g,CoonTown,called them out for being white-hating jews    >you have been banned from posting to /r/baltimore: The City That Reads.,I was banned for posting this on their interactive map of where the riots were...  http://i.imgur.com/tQzpHsk.jpg,https://www.youtube.com/watch?v=ZRuCMujPgOM,0,0,0,6.0,1.0
e1einqv,CringeAnarchy,"I don’t see those as cultural issues as much as symptoms of poverty. Black Americans are poorer than white Americans because of racist institutions, so it seems only fair to me that those institutions do some work towards fixing the problems they caused. I also think it’s possible to call out racism at the same time that one works on bettering themselves. ","There are more poor uneducated white people then black people. More white people on government assistance then black people. Granted not as a percentage but still the overall number is more. Yet, in these poor white communities you do not see the same high rate of fatherless households or violent crime. Those are products of a broken culture not racism. ","That's not an argument dude, there's more white people than black people, so of course there will be more of them that are poor and in welfare programs",0,1,0,9.0,0.0
elrt3np,CringeAnarchy,Joes Bidens team have lost their minds.,What does the N even stand for??,It’s part of 6 pictures that spell Biden. They likely used some software to do the image and put it on Instagram without looking at how it would divide the image lol     https://www.instagram.com/joebiden/?hl=en,0,0,0,1.0,1.0
di8fbt4,CringeAnarchy,I am such a gamer gurl!! I play Candy Crush all day long! I am such a Nerd..    Edit: People calm down. It is a common joke and it doesn't need to get analysed if it belongs into the gatekeeper folder or nah,/r/gatekeeping,"I think he was making fun of girls who identify as ""gamer girls"" and not ""gamers."" There's no gatekeeping here ",1,0,0,33.0,56.0
dq9ef0x,CringeAnarchy,I mean they didn't exactly want him back lmao,They didn't want him back because he's not very good.,Didn't he help get the 49ers almost to the superbowl a little bit back?,0,0,0,102.0,3.0
f0z0bpm,Delraymisfits,Here is broke almost crying scared for his life. He acts tough against a handicap but is actually the biggest pussy https://youtu.be/3ZVj2w7atTo,"Dude, he was locked in a house with armed cracked out drug dealers/gang members threatening to kill him. wtf would u have done?? Also, he wasnt almost crying at all, in fact he was laughing through most of it.. just sayin..","Lmao broke is a cracked out drug dealer as well. Plus, in the video you can see it wasn’t a “gang” teaming up on him. It was one guy who was pressing broke, the rest of the people there were protecting broke. Also he was doing that fake laugh once he was safe and hidden in the bathroom to try to keep his tough guy persona afloat. Broke picks and chooses who he will act tough against, which is mostly handicaps.",0,0,0,1.0,1.0
dwodyaj,Delraymisfits,What's this about chemicals in sunscreen?,"There's chemicals in it. You put it on your skin, those chemicals get absorbed and some people started saying those chemicals cause cancer.  Probably very untrue scaremongering/clickbait from the first page of results on Google being sites I've never heard of, and the years of research into sun exposure on cancer risks.    Brad is entertaining but I wouldn't take life advice from him. ","In one of my papers at uni I actually wrote about this, it's a genuine risk and some people think that the aluminium in sunscreen can exacerbate sun damage ",0,0,0,8.0,1.0
e1m46uy,Delraymisfits,"Too many exceptions    -not a world class slash powerlifter bodybuilder  -doesn’t know science  -not a YouTube celebrity   -doesn’t make 10k per day CEO  -ect.,ect.,ect...",But he is       -fat    -can barely speak intelligibly,It’s the off-season bro. You don’t know science.,0,0,0,-3.0,8.0
dzrj8nz,Delraymisfits,I want this hoookers IG account,http://instagram.com/ali__day95,"What's her actual name, does she have any porns? A friend wants to know...",0,0,0,7.0,1.0
e3p8cf5,FuckYou,"I'M NOT YOUR BUDDY, PAL.","IM NOT YOUR PAL, FRIEND","I'm not your pal, champ!",0,0,0,11.0,12.0
dnsz7g5,FuckYou,"Glad I found a place to let my anger out on. First off, I'd like to say fuck school. Oh my God, fuck school. Everyone at that God forsaken place is a fucking cunt. Secondly, fuck the dumbass people in my town. Seriously, you all fucking drive like goddamn idiots. And you can't even fucking get good service in these fucking restaurants around here anymore. And last but not least, fuck each and every last one of you chicken fuckers for not realizing that I am a fucking bullied kid. You can all eat my dick.","“Waa was waa school is hard, waa waa I’m having a bad day.” Lookee here you lazy antisocial stupid egotistical entitled piece of human garbage, IT DOESN’T GET BETTER! School, college, working, you will struggle every fucking day fighting off poverty, hunger, cancer, bullets, and furries in sweaty jizz matted fur suits.    You are never going to do well unless you man the fuck up, and stop being a fuckin cunt about it.     These cunt waffles are everywhere not just your town. If they were in just your town, fucktardville would have been the site of the first nuclear bomb and the Jews would have been saved.    Drivers suck everywhere, fucker.    As for lacking good service at eateries, if you know so god damned much about what good service is, cut your fucking hair and get a fucking job. Show those faulty fucking fucks how to fucking do their fucking job. Or just don’t be a fuckbag to them. They deal with hundreds of spermguzzlers every fucking day.     We know you’re fucking bullied, you will always be bullied, just like all of us you entitled fuck. Get the fuck over it,     As for eating your dick, don’t worry about it, the service here is shitty. The dicks always come out cold and under seasoned.    P.s. fuck you","Cunt muffin and twat waffle good sir. It rolls off the tongue better. Sincerely, Fuck You",0,0,0,7.0,2.0
c6joi19,FuckYou,My opinion on Redditors,But.... You are one..,He's talking about the stereotypical redditor. Not all are the same.,0,0,0,2.0,1.0
cytmkek,FuckYou,C,K,Y,0,0,0,5.0,5.0
ee9qpo4,GenderCritical,"Immigration in Europe Disclaimer: English is my second language. I use this account because people I know in real life know my real account and it would be a problem if they knew I use this subreddit.  I don't know if this opinion will be welcomed here but I don't know where else to go and I am so sick of having to hide how I feel.  I am from an European city and I am sick and tired of immigrant men. Muslims, Turkish, Nigerians, Moroccans, Afghanis... I don't know where they come from and frankly I don't care anymore. I am tired.  I'm tired of them following me in the streets in the middle of the day, shouting at me in multiple languages, touching me to get my attention, approaching me when I'm minding my own business and not leaving me alone until I have a conversation with them ""Are you from Africa? Where are you from? Why don't you respond? Smile, be happy. I just want to talk. What language do you speak? Are you waiting for someone?""   I'm tired of having to take the long way home because they're standing there in groups 24/7 and if I walk by them at least 2 of them will follow me and shout.   I'm tired of the way they look up and down my body when I walk near one and I'm especially tired of how so many of them look at me with what looks like disgust and rage and hate.   I'm tired of having to walk to local men at night and give them the look so they pretend they know me and defend me from an immigrant so he will leave me alone.  I'm tired of how they laugh when it's obvious I'm scared.   I'm tired of feeling unsafe in the city where I always felt so safe.  I'm tired of my blonde friend having to wear a hood whenever she walks alone, I'm tired of seeing other friend research and buy all types of pepper spray but feel scared to leave with them in her purse anyway because they're illegal, I'm tired of how another friend had to buy a bike to get home quicker so they wouldn't follow her, had it stolen by one of them, bought another, and had him follow her home riding the bike he stole from her while his friends laughed from the sidewalk.  I'm tired of hearing of a new rape every week.  I'm tired of replaying in my head the moment one of them stabbed my friend in the arm to steal his wallet.  I'm tired of seeing them sell drugs to kids.  I'm tired that they somehow sense when the police is coming and leave before they get here.  I'm tired of being called racist online when I say I think they should control immigration more. I'm not racist, I don't care about their skin colour. I'm tired of their culture, I'm tired of their disrespect towards women. It is incompatible with my country's culture but everyone ignores that. I'm tired that no one does anything about this. I'm tired that the only people that agree with me are extreme right-wing politicians who hate women just as much as those men do.  I'm tired and I really don't know what to do anymore.","You posted an anecdotal experience because nobody can discredit it without being accused of silencing you or ignoring your experience. You posted the “Are you from Africa?” to imply that you are black and thus not a racist white person. You posted the “local men protect me” to imply that local (white) men are inherently better and less sexist than non-white immigrants, and to elevate them above Men of Color. You mentioned the “blonde” friend to play into the stereotype of the innocent blonde girl being attacked by the savage, backwards immigrant. This is blatant racism and I can see through this shit.","This is fair that you think this and I can't change your mind. But I can defend ""are you from Africa"" wasn't to say I'm black because I am not black. They ask that question to everyone to start conversation. If anyone is from Europe here maybe they can confirm it",1,0,0,1.0,1.0
f8vjq72,GenderCritical,"They would hate being a woman because a lot of time is spent having to think about other people (wife-work, mental load, kids etc) rather then obsessively thinking about themselves.    You never see them on a webcam planning the weeks menu, or trying to arrange the family logistics so that kids go to violin/judo/parties etc.  They never have that vacant look when your mind just needs to sit open for one fucking moment so that vital bit of lost information can float back in.    Christ, I even know my kids usual pooing schedule, and can counter that in if they don’t feel well.",Are you aware that most people in trans subreddit are minors? Just a thought.,A significant number are teens but also a significant number are adults. Personally I've come across more 30+ trans people than younger...,1,0,0,1.0,1.0
fsf826i,GenderCritical,"Am I the only one who sees male on male violence as the main problem in these riots? I'm not American so the racial aspect is definitely something I don't fully understand and as a white woman never will. But there's one thing I do understand. The constant threat of male violence.   I see women, black and white, protesting peacefully. I see men, black and white, using violence. I see male police officers abusing their power and I see male protesters abusing the situation to misbehave.   I saw an article where the police officer's wife wanted to divorce him and how often male police officers abuse their female partners. Behind every police officer who kills an innocent man there's a woman being abused every day at home.   I see black women afraid to call out abuse by black men because they are afraid to be called racists.   I'm curious what other people think of this situation, especialy black women.  I know this is a sensitive subject, but don't be afraid to to tell me if you don't agree.","There are many women involved in the fightings, too.","Yeah, I don't think the take away from OP's post is that women never ever participate in rioting or violence.",0,0,0,1.0,1.0
f5x14oj,GenderCritical,">except their internal organs and not having XY chromosomes.    What is your definition of a woman? Because mine is having women’s internal organs and XY chromosomes. Everything else is literally made up by society.     It sounds to me like your definition of a woman is someone who wears feminine clothing and enjoys feminine things and I cannot think of a more offensive definition. Being a woman has nothing to do with feelings or clothes or preferences. Society told us girls like pink and glitter and we followed, but girls existed apart from boys before pink and glitter did. Women were raped and killed by men simply for being women before pink and glitter existed.     Those “women” you’re talking about are men who decided they didn’t like or do the things society *told* them to do. They are going against *society* not biology. They’re gender non-conforming, but their sex is still male.     The fact that men will become violent towards someone who is not like them is not women’s problem. But the fact that men have been using their size and strength against women for millennia is women’s problem. If men won’t accept their own, the women’s bathroom should not be their refuge, because the women’s bathroom is a refuge and safe space for *women,* the ones with female internal organs and XY chromosomes, the ones that are at a physical disadvantage and in a vulnerable position (as in with their pants literally down). To allow a person with the build and possibly genitalia of a man puts every woman in the bathroom at a physical disadvantage and it is no longer a safe place for women.",XX chromosomes perhaps?,"Ahhh, crap. You got me. I meant to say XX. Hopefully my point wasn’t lost in all that confusion. I’ll fix it.",0,0,0,1.0,1.0
ckd01rd,GreatApes,"As a wealthy black man, I ignore hip hop and all that nigger shit. I like me some jazz and Beautiful Black Women who aren't Sheila Boones.",Harvard-educated African man here; some of us have culture and intelligence.  It's mainly the sub-saharan beasts and their offspring who do not.,Isn't anyone north of the sahara technically an Arab? I don't consider them black.,0,0,0,5.0,3.0
cmagsbi,GreatApes,Hope ya'll get shot and killed xoxo,I really want to be with you on this but I'm against shooting the mentally handicapped.,"Nah, I don't think they are mentally handicapped.    Just socially conditioned.    Still should be shot regardless imo",1,1,0,-1.0,-1.0
