id,subreddit,context,newcomer,reply,newcomer_counterspeech,reply_counterspeech,reply_attack,newcomer_score,reply_score
f237hdc,Trufemcels,"I feel like everyday something new is wrong with my face As if i wasn’t ugly enough, today i woke up with milia next to my eyes, which can only be extracted and i can’t afford to go to the derm :)) fuck my life. I’m too young to be this monstrous",I’m sorry you’re going through this. I developed a milia on my eyelid and under my eye. Using kora orgaincs eye oil in the morning and night made one of them fall off. The other one I got rid of using retinol. You can get retinol for pretty cheap. You just have to be careful because it’s strong.,how long did it take for the eye oil to work? i have milia right next to my eye,0,0,0,1.0,1.0
doib13g,WhiteRights,Let me counter you    What is black culture and what do you consider the cultures to be of the people flooding white nations,I'm not attempting to make a point. I'm attempting to gather knowledge from this who can provide it.,Well in that case Id put forth the following:    Environmental awareness and preservation is an explicitly white cultural trait as well as animal rights. Subgroups of literature comprising genres like Romanticism and realism throughout the years are unique to white countries. Operas. Film.    If you're asking me to define specific cultural traits comprising all whites rather than just broad strikes it would take time to comb through each group and find similarities.,0,0,0,3.0,3.0
co5gjbo,WhiteRights,Hi I'm a black person AMA,"What do you think of cultural marxism, political correctness, critical theory and statements like ""racism = power + prejudice""?","One thing that I hate is when people see a ghetto white person and say ""He acts black"" or a black person that can actually hold a conversation and say ""He acts white"". Culture is somewhat based on environment at least how I see it. I remember I took a visit to philly and every person there was dressed exactly the same and had the same way of moving, regardless of skin color. [And regarding political correctness, let's just say that this is fucking ridiculous](http://m.wikihow.com/Be-Politically-Correct)  And lastly anyone can be racist. I think I got everything. ",0,1,0,1.0,2.0
cuhpjfw,WhiteRights,"I support this, not only because the Ahmaddiya are the basically the real post-reformation Muslims people keep demanding and are hated by all the actual awful Muslims, but because it sets precedent for the inverse being true.",Yea maybe they can have separate water fountains too?,[This ain't America](https://en.wikipedia.org/wiki/Block_settlement),0,0,0,1.0,1.0
codb3ib,WhiteRights,Al Sharpton giving some history lessons,I thought this might make me angry. It did. I dont blame them though. If I didnt come from a people with a great history I would be pretty pissed too and would probably make shit up. But it also shows how the entitled live in the past. So they have a shitty history. They should be trying to build one for their descendants rather than invent one that they can  to enjoy now.,"I agree they have had a shitty history, but a true leader of people looks forward positively, and only quietly looks back to remember lessons learned.",0,0,0,1.0,1.0
gaq3itn,asktrp,"Evidence for marijuana’s negative effects on health is shaky at best. I don’t think anyone is under the impression that smoking all day everyday is a good idea, but responsible use is fine and unlikely to have any noticeable affect one way or the other.",You should stay the fuck away from it if you have close relatives who suffer from schizophrenia or other psychotic disorders though.,"No, yoy shouldn’t smoke if YOU have psychiatric issues. Your family isn’t you, and you’re psychological issues are only yours to fix and deal with",0,0,0,1.0,1.0
cy02mdq,asktrp,"Don't listen to these guys. Write the post and post it to Facebook. Go overboard, so that she eats it up. Just set the privacy setting on the post so that she's the only person who can see it. No one else will be able to see it if you set the privacy value correctly. Problem solved. This will get downvoted for sure, but it's the only right answer. ","..That's the wrong answer even if it's a comfort test.     If it's a comfort test, comfort her without giving her what she specifically asked for.     There's no reason for him to satisfy the arbitrary specific whim that she be praised on facebook. What she wants is validation, and she had a whim about how she wants it. She doesn't realize if her whim is satisfied, it has greater effects on her feelings for itsme74 than just satisfying her need to be validated.     This all assuming she's an innocent naive person and doesn't have some ulterior motive like AFPJ mentioned.","Sexynudes actually has a good idea, but then again alphakari has a good point. What happens if I do it even if I have set the privacy settings? It will show her that she has some control over me and she may figure out that she doesn't want to date a wimp that obliges her every whim because there will be more whims after this one if I do this.",0,0,0,0.0,1.0
f3gwrtq,asktrp,"LTR has b-day party with close friends, we drop shrooms and drink, she ""jokingly"" calls out her apartment number to 2 random guys she saw from her balcony, guys show up to the apartment, she lets them in, she offers them shrooms, and then gives them her number. I honestly feel pretty gross that things got this bad, but I wanted to hear what TRP community thinks about my situation. Personally, I'm very upset over this and have ended things and ghosted her the last few days. She's not taking it well but it's expected.  Been dating this girl about 6 months, more serious in the last couple of months. Overall she treats me well and worships my dick. We fight sometimes, but it's usually over small things and we've been getting much better at resolving problems. The passion is great, the sex is great, we connect great on a personal level, I have fun with her and she has fun with me, so when things are good they're REALLY good. She's been constantly there for me, she buys things for me, she definitely invests in our relationship. But the truth is that you can have things be amazing 98% of the time, but that 2% is all it takes to completely break your relationship.  My GF is one of those ""has a lot of guy friends"" but they're not the kind of guy friends that try anything (at least not the ones I met). They're guys she grew up with, guys that are actual friends and know her family, guys that I met and I can tell they're good people and I trust them. We have boundaries anyways like she can't hang out alone with them drinking late into the night or any of that crap. She doesn't overstep her boundaries (that I know of). However, I have caught her in a couple of small white lies (red flag) which she usually admits to and apologizes for it. It does give me some trust issues obviously, but so far the lies have been small and harmless.  Fast forward to this event... for context, my girlfriend lives with a gay roommate (who wasn't around that night), and they're both in their mid 20s. They find that a lot of people in their building are seniors, so apparently they've been looking to make friends with people in their age range to have people to hang with. That night, she had a few close friends over and we decided to celebrate her bday by doing shrooms (my gf only did shrooms once in her life before) and drink. We were having a great time, she was high energy, she was drinking. In the middle of our trip, we step outside in her balcony for a smoke, and my gf and her friends notice some guys downstairs, so she ""jokingly"" calls out her apartment number to them. Guys show up to our unit with alcohol looking to obviously meet females, we're all a bit surprised and not really sure if we should let them in, my gf decides to let them in because they live in her building so it's safe. They quickly change their stance when they realize it's not that kind of party. They're nice guys, one even apologized to me saying he sees that I'm in a relationship with her. What was really strange to me was how excited my gf was to bring these guys into her life so quickly. Now to be fair, my gf is a friendly, outgoing, bubbly person, and that night she was high on shrooms and drinking, she was really high energy. But I've never in my 6 months of dating her seen her act so excited to be around new guys and give them her number so quickly with intent to hang out. It was the most uncomfortable disrespectful feeling I've experienced in the last 8 years of my life. Even fuck buddies would never do something like that in front of me. The next day I snapped at her and yelled at her, told her wtf was she thinking and why did she give them her number. She took the most naive clueless defence she could have taken, telling me it was perfectly harmless, they're just guys in her building, I was right there the whole time, they could tell we were together, they were nice guys, blah blah blah. She was incapable of understanding what she did and why it upset me. She tried to tell me that she was just looking at them as friends, potential guys her and her roommate can hang with or go party with if they ever throw parties. She even tried to say that one of the guys (the guys he gave her number to) was ""probably gay"" as if that would diffuse the situation at all. She kept saying that I need to just trust her, and that if these guys are a problem, I should have just calmly told her that I'm not comfortable with them hanging out and she would just not respond to their messages. But she doesn't get it. I should't have to explain to her what she did was wrong and that it bothered me. It should just be common sense. We talked the following day about it and she couldn't understand why this upset me so much and she should be allowed to make new friends. So I broke up with her and ghosted her.  I don't understand how she can be this ignorant and what the purpose of this whole thing was. My GF is super busy with work and school and so am I, so there should be no circumstances that she should be so excited to make guy friends with drunk strange men at 2am, and talking about partying with them. She was talking about exchanging numbers with 5 minutes of them stepping into the apartment. I'm of the opinion that if I'm dating a girl, she shouldn't be acting like an 18 year old college slut, excited to have some strange dick around. Those guys were tall, built, good looking dudes, so you know attraction had an influence. Those guys were doing nothing wrong, they were drunk, it was 2am, they were looking for a fun time, they heard some girl call out the apartment number for a party, they decided to come up and make friends. No beef with the guys, they were very nice and respectful to me, and my girlfriend was all over me the entire time and bragged about how good of a boyfriend I am to them. After an hour the guys left and then they came back a bit later because they were high and wanted to chill. We all sort of decided not to let them in so I went to answer the door and my gf asked me to be nice to them (WTF?). I calmly told them we're going to sleep soon and they left.  Overall, would you ghost her for this?",“My girlfriend was all over me the entire time and bragged about how good of a boyfriend I am to them.”    It sounds fine to me. I’m surprised you dumped her.,"Did you read the whole story? Lol she was also talking to them about partying in the future when they first arrived and she gave them her number eventually too. Not sure how you don’t see this after reading the full story.     If I picked up two drunk thots in front of my gf at 2am, invited them into my apartment, gave them my number, had them text me so I could save it in my phone, and then tell my gf that I’m so excited I made new friends, I think she’d leave me on the spot lol.     I wish it was nothing but the experience was so uncomfortable and she didn’t think she did anything wrong. She’s a psycho I think. I think she cheats behind my back 24/7. Your comment is so different from everyone else here. Why?",0,0,0,1.0,1.0
f787l1e,asktrp,me nine!,Hey me X!,Hey me XI!,0,0,0,1.0,1.0
c60nmay,dolan,hy goob dis is imposibl,who the fuck is goob?,"Was my first time making one of these comics, sorry if anythin is wrong",0,0,0,1.0,3.0
c60h2zo,dolan,If you look at it backwards Dolan is a hero who saves a baby.,"If you look at the Holocaust backwards, Hitler turns out to be a pretty decent guy in the end.",Sieg heil mein fuehrer! Der Grossdeutschesreich!,0,0,0,4.0,1.0
c74b7ly,dolan,fax n chicx,What about Lady and the Tramp with regards to the park scene where they wake up together the next morning?,101 dalmatians certainly weren't a product of in vitro fertilisation either.,0,0,0,3.0,4.0
cqngti7,dolan,"jesus why are u such a faggit? there's a fine line betwen broken engilsh and the fuckery u did. dolan is suposed to be bad engilsh, not unreadible shit like u jus did",Holy fuck that was painful to try and read.,http://dolantranslator.com/   i dinut evun tri,0,0,0,4.0,1.0
co5s80y,fatpeoplehate,"Okay, so anyone who doesn't know what this is from, here it is:    https://www.youtube.com/watch?v=sUyfwqDetAA    It is honestly one of the best examples of how bullshit the HAES ""movement"" is. It's a video done by Regan Chastain and one of her cronies called ""Fit Fatties Across America."" Basically it was intended to be a show of them traveling across America to see people from the ""Fit Fatties"" group and do ""fit"" things with them. The absolute ridiculousness comes from the fact that the ""footage"" of them doing fit things are all photographs. There's a photo of one standing ""walking"" with a dog, one of a woman ""swimming,"" but she's not even doing that, she's just walking in the pool. The ""cycling"" shot is a totally not sweaty fatty standing with a bike, so I totally buy that she was out riding and stuff. The only actual footage of them moving is this ending shot of them ""completing the journey"" by reaching the Pacific ocean. Honestly, everyone should go watch this video just to see the incredulous looks on the bystanders' faces while they ""finish.""     It really is just the most outrageous thing.",A normal person doing this journey would just cycle across america. Did these guys just fly or something?,"It was a virtual journey. Over 1500 people logged distances travelled and they got to 2800 miles in ""just over ten weeks"". That's less than a mile per month per person.",0,0,0,8.0,18.0
co8a05v,fatpeoplehate,"Is that fast, 'cause I don't know, I don't really compare my time to others and I always push it past 70 rpm, really great warmup.    Edit: realized i said mile, meant half mile 😛 =P (for those non mobile users)","In .5 miles, there are 2640 feet. So basically, what you're telling us is that you can clear 66 feet (or about ~20 meters) in one second. While not completely impossible, it does seem a little far-fetched for someone with asthma and (presumably) starting cycling. Are you sure that's not your record half mile down a slope or something =|? ","Ive been doing it a while and only go a minute or two or even three as part of a warmup for my workout. I dont always go a mile, sometimes its half a mile sometimes its over a mile depending on how I feel that day. And it isby bo means 40 seconds itranges anywhere betwee. 40-to 55ish seconds",0,0,0,1.0,1.0
cqe5nz4,fatpeoplehate,"It's actually a big thing in NYC public transportation right now as the MTA recently passed a rule against it. Generally speaking, it's not a big deal for a guy to sit with his legs slightly spread. But when a guy is taking up the space of multiple people it's an issue (or so they say).    I don't see it happening that often, so I'm not sure what the big hubbub is (aside from an overabundance of SJW living in NYC)",Remind me never to go to NYC.,Well that's a stupid reason to not visit NYC...,0,0,0,5.0,11.0
cn9vx12,fatpeoplehate,"You know what the scariest part is? Even when they are full term you still can't tell they are pregnant. Half the time they can't even tell. They get so fat their bodies stop menstrating, it's natures way of trying to prevent them from breeding. Definition of abomination. ","Oh look, it's the fatasses from the sub attacking you, here to downvote your week old posts.  Have an upvote!","Hahaha, it's amazing they can lurk so well with all that girth..... How do we not notice them sooner?!",0,0,0,1.0,1.0
ep1avji,frenworld,"Don't eat them he will probably boop your no no place, take your inside funny stuff or maybe sell you to bad people that will boop your no no parts if you eat them... he is very dangerous fren Pls respond so i know you are safe fren",Do you know how retarded you sound?,Not very frenly comment 😢,0,0,0,-16.0,7.0
emgf1xw,frenworld,what makes people fleeing violence nonfrens🤔,Oh yikes ur taking this serious aren’t you,haha keep nonfrens out of my country I want to keep us pure fren haha get it 😎😎,0,0,0,11.0,-10.0
enhsumv,frenworld,Casual racism,No dude this is actually really clevaer and freakin epic xD,That picture is a meme maybe get your mind out of the racism gutter,0,0,0,8.0,3.0
eb7d6jy,frenworld,They Took This From Us :(,:( i just want a fremnily,:(,0,0,0,14.0,6.0
emv9ajz,honkler,What gender are people born XXY?,"How many arms do humans have? Two? It’s true there are exceptions, but that doesn’t mean that we should teach that humans don’t have two arms.",So we should teach that humans exclusively have two arms?,0,1,0,9.0,-7.0
elkwazf,honkler,"Nobody is parsing anything--the sequence is always     Step 1: you make an obviously fascist meme adding something really stupid (e.g. clowns),     Step 2: We say: ""hey look this right-wing meme is both stupid and fascist, truly right-wingers are all degenerates""     Step 3: You say ""no u"" for a while, and then claim success at owning the libs.    Step 4: We go back to step 1","Step 2.5: ""I don't know what you're talking about. Clowns and facism? That's something a fucking retard would think (hail hitler)""",That's step 1.,0,1,0,1.0,1.0
eshk862,honkler,Niggers aren’t human. Always remember that.,You are a low rent AHS sockpuppet,You defend transgenders and then call me a leftist. Fuck off fag-enabler. https://i.imgur.com/gSmiJBn.png,0,0,1,1.0,1.0
emx98nq,honkler,"You gon link that Etsy shop, fam?","Haven't decided if I want to go that route, as I will be immediately kicked off Etsy. Might make my own merch site...I also have ""learn to code"" and ""it's okay to be white"" embroidery as well, this is my first picture though.","Hell yeah, dude.",0,0,0,3.0,1.0
e2hevc4,milliondollarextreme,Look who's finding parallels to reality in his favorite magic fantasy novel!,"Usually you may have a point.     But this is fucking Tolkien. He wrote the second best stories ever told. The man invented a genre and created a new age mythology for Anglo-Norman peoples.   Tolkien’s works transcend “muh Phantasy boohks.”  His works, thoughts and writings have defined all fiction to follow, and likely always will.     On top of that, many situations in Arda do in fact have significant parallels to modern day events, such as troubling industrialization, foreign invasion, loss of culture, religion and identity and how hope can unite a people to push back darkness.    Don’t compare such genius to schlock like Harry Potter.","I'm not comparing Harry Potter with the Lord of the Rings. That would be pointless. They're both important works of literature in their own right. How many people would never have read TLOTR if they never discovered the joy of reading through HP as kids/young teens?        What I am comparing however, are the people who compare those fictional novels to reality to prove a point. (""We need more Hermiones""/Orc posting).    My conclusion: They're both the same kind of idiot who would twist any work of art to fit their political narrative and too stupid to think of their own propaganda, which is why they (ab)use the work of people greater than them ",0,0,1,2.0,1.0
e1k3in3,milliondollarextreme,"American Bullies are used for cheap dogfighting all the time. AmBullies have strong pit blood, they are basically pit mixes.     > 40 or so years of breeding for fighting of a very few select dogs does nothing overall to the breed.     Nothing, oh really?     *40 years*?     ""OMG just because shepherds were bred to herd for years it does nothin iveall to the vreed!!""    And they **are** aggressive to people. ""Non human aggressive pits"" is a myth. ","""Ambullies are used for cheap dogfighting all the time""     Where? Prove it.","“Unlike a true American Pit Bull Terrier, the  American Bully hadn't been created for the fighting ring, although many of these dogs have been used for amateur level street fights by their ignorant and oftentimes criminal owners who believe them to be actual Pit Bulls [...]”    “Originally a result of crossing the  APBT, American Staffordshire Terrier,  American Bulldog,  Olde English Bulldogge,  Bullmastiff,  Dogue de Bordeaux,  English Bulldog,  Neapolitan Mastiff and various bandogges with the aim of developing a larger and heavier Pit Bull [...]”    [Source](http://molosserdogs.com/m/articles/view/3248-american-bully)    From which many of the precursor breeds were fighting dogs.    ",0,0,0,1.0,0.0
dd0xcmn,milliondollarextreme,Pop culture lol!!,I laughed :(,FEEL ASHAMED,0,0,0,2.0,7.0
dkcw8ze,milliondollarextreme,"I see so many harlots like this on Tinder. They put their mulatto babies in their pictures, idk why.",Would you rather they not?,"man's got a point, they're actually being polite",0,0,0,30.0,33.0
doifzml,opieandanthony,I would rather destroy myself with drugs and die prematurely than live a long and happy life as a tranny chasing perv.,happy life? have you heard his cries for help when hes chip? hes miserable,Relatively speaking considering Artie’s suicide attempts and general quality of life.,0,0,0,2.0,2.0
cs8y8hq,opieandanthony,"TACS Hate? Yesterdays episode was good up until the guest. Today was an extra hour and more than made up for a bad 20 min yesterday. They can't all be 100% win. That said Ant could use a co-host to do the more boring show guiding stuff and play good cop/bad cop with him to twist up guests like O&A used to. I think a lot of you just want to vent hate and got bored with targeting Opie because every possible criticism had already been said. A lot of you are hilariously mean but turning on Ant now too is just coming off more sad, whiny and pathetic than funny. I come here for laughs not douche-chills. I listen to Opie and the Stangels for that.","I think its time to separate /r/opieandanthony and /r/tacsdiscussion.    Its like a boyfriend and girlfriend that no longer see eye to eye,  and agree to make an amicable split.    90 percent of the people here get their gossip from half thought out posts, and turn it into something bigger than it is because they dont sub, just read the live thread, which by the way is rarely indicative of the nuances.  ",Smaarmmaaay,0,0,0,-7.0,3.0
clu8zj1,opieandanthony,"And even then, it was obvious he couldn't tell which instant feedback jokes were funny and which weren't.     He had a batting average of about .300 using *other people's material*. He should have been hitting home runs every other time he read a joke off the feedback stream. ","And sometimes he'd get a good line but he wouldn't actually get the joke, but he'd still repeat it and fuck it up.","The most offensive example of this was when they were reading Worldstar comments about Chip. It's simultaneously a fantastic and an unlistenable bit because basketball Americans describing Chip in hoodspeak is hilarious but Opie butchers every single line he reads out to the point you genuinely aren't sure if he's doing it on purpose.    He isn't though, he's just a barely literate manchild  ",0,0,0,7.0,13.0
ed09gcj,opieandanthony,Got more votes,Not the only kind that have mattered for the last 230 years.,Not my fault we have an ass backward system,0,0,0,1.0,1.0
dmaeoo0,sjwhate,"So they apologized, but didn't fire anyone, and then updated their apology by blaming everyone else for judging their company based on their PR? Wow. I judge them more for that update than the original tweet. It's so condescending and blamey.",I thought the right hated when employees were fired for voicing their opinions?,Firing maybe a little over board (tho the vindication is always juciy and sweet) but for me if they forced the person who made the tweets go down and help the people i would be happy. Shit heads should not be rewarded they should be punished but in a constructive mannor. Making that shitty human go and see the horrors of what happened and help those in need might actually change them to be not a shitty person. Worse case you just made a sjw work and help people and not hitting them for once.,1,0,0,-8.0,13.0
dxy24cw,sjwhate,Cultural appropriation?,"Come on now this kid is not doing anything wrong  , just some old good natured kidding around",exactly,0,0,0,15.0,9.0
dej0v88,sjwhate,Someone here really likes to sexualize (and add unexistent details) circumcision. Are you that creepy uncle that touches kids?,He's referencing stuff like this  http://healthland.time.com/2012/06/07/how-11-new-york-city-babies-contracted-herpes-through-circumcision/     Tl;Dr orthodox circumcision involves sucking blood from the baby penis,"Thank you for the reference, so it was herpes not gonorrhea?    I apologize to all the jewish people I have offended with my baseless lies.",0,0,0,16.0,4.0
d9dm03w,sjwhate,It's more subtle than that.,"I don't get it, could you explain it?",George Washington Carver,0,0,0,2.0,-1.0
